{
  "claim_ir": {
    "claim_id": "AI-XML-001",
    "source_text": "用XML标签把提示词里不同类型的内容分开可以减少模型的误解。",
    "operator": "FACT",
    "subject": "用XML标签把提示词里不同类型的内容分开",
    "predicate": "可以减少",
    "object": "模型的误解",
    "polarity": "POSITIVE",
    "quantifier": "UNSPECIFIED",
    "modality": "ASSERTED",
    "scope": {},
    "anchors": {
      "subject": {
        "text": "用XML标签把提示词里不同类型的内容分开",
        "start": 0,
        "end": 20
      },
      "predicate": {
        "text": "可以减少",
        "start": 20,
        "end": 24
      },
      "object": {
        "text": "模型的误解",
        "start": 24,
        "end": 29
      }
    }
  },
  "evidence": [
    {
      "evidence_id": "E-AI-XML-001-1",
      "source_id": "DOC-PROMPTING-BEST-PRACTICES",
      "source_kind": "official_documentation",
      "locator": "https://platform.claude.com/docs/en/build-with-claude/prompt-engineering/claude-prompting-best-practices",
      "source_text": "XML tags help Claude parse complex prompts unambiguously, especially when your prompt mixes instructions, context, examples, and variable inputs. Wrapping each type of content in its own tag (for example, <instructions>, <context>, <input>) reduces misinterpretation.",
      "quote": {
        "text": "Wrapping each type of content in its own tag (for example, <instructions>, <context>, <input>) reduces misinterpretation",
        "start": 146,
        "end": 266
      },
      "date": null,
      "derived_from": [],
      "cites": []
    }
  ],
  "semantic_reviews": [
    {
      "claim_id": "AI-XML-001",
      "evidence_id": "E-AI-XML-001-1",
      "relation": "ENTAILS",
      "reviewer_id": "claude-opus-5",
      "claim_fragment": "用XML标签把提示词里不同类型的内容分开可以减少模型的误解",
      "evidence_fragment": "Wrapping each type of content in its own tag (for example, <instructions>, <context>, <input>) reduces misinterpretation",
      "missing_bridge": ""
    }
  ],
  "adversarial_reviews": [
    {
      "claim_id": "AI-XML-001",
      "evidence_id": "E-AI-XML-001-1",
      "relation": "ENTAILS",
      "reviewer_id": "claude-haiku-4-5-20251001",
      "independence": "SAME_FAMILY",
      "evidence_fragment": "Wrapping each type of content in its own tag (for example, <instructions>, <context>, <input>) reduces misinterpretation.",
      "strongest_counter_reading": "The evidence asserts a correlation between XML tag separation and reduced misinterpretation, but could be interpreted as describing observed behavior rather than providing causal evidence. One might argue the benefit comes from structural clarity generally, not specifically from XML syntax.",
      "what_would_falsify": "Controlled experiments comparing Claude's interpretation accuracy on identical prompts with and without XML tag separation, showing no statistically significant difference in misinterpretation rates. Alternatively, official Claude documentation being updated to retract or qualify the statement."
    }
  ],
  "adversarial_policy": "required"
}
