{
  "claim_ir": {
    "claim_id": "AI-CACHE-001",
    "source_text": "只要开启提示缓存就一定比不开更便宜。",
    "operator": "FACT",
    "subject": "只要开启提示缓存",
    "predicate": "就一定比不开",
    "object": "更便宜",
    "polarity": "POSITIVE",
    "quantifier": "UNSPECIFIED",
    "modality": "ASSERTED",
    "scope": {},
    "anchors": {
      "subject": {
        "text": "只要开启提示缓存",
        "start": 0,
        "end": 8
      },
      "predicate": {
        "text": "就一定比不开",
        "start": 8,
        "end": 14
      },
      "object": {
        "text": "更便宜",
        "start": 14,
        "end": 17
      }
    }
  },
  "evidence": [
    {
      "evidence_id": "E-AI-CACHE-001-1",
      "source_id": "DOC-PROMPT-CACHING",
      "source_kind": "official_documentation",
      "locator": "https://platform.claude.com/docs/en/build-with-claude/prompt-caching",
      "source_text": "On the Claude API, Claude Platform on AWS, Google Cloud, and Microsoft Foundry, the minimum cacheable prompt length is: 512 tokens for Claude Opus 5, Claude Fable 5, and Claude Mythos 5; 1,024 tokens for Claude Opus 4.8, Claude Sonnet 5, Claude Sonnet 4.6, Claude Sonnet 4.5. By default, the cache has a 5-minute lifetime. The previous table reflects the following pricing multipliers for prompt caching: 5-minute cache write tokens are 1.25 times the base input tokens price; 1-hour cache write tokens are 2 times the base input tokens price; Cache read tokens are 0.1 times the base input tokens price.",
      "quote": {
        "text": "5-minute cache write tokens are 1.25 times the base input tokens price",
        "start": 405,
        "end": 475
      },
      "date": null,
      "derived_from": [],
      "cites": []
    }
  ],
  "semantic_reviews": [
    {
      "claim_id": "AI-CACHE-001",
      "evidence_id": "E-AI-CACHE-001-1",
      "relation": "CONTRADICTS",
      "reviewer_id": "claude-opus-5",
      "claim_fragment": "只要开启提示缓存就一定比不开更便宜",
      "evidence_fragment": "5-minute cache write tokens are 1.25 times the base input tokens price",
      "missing_bridge": ""
    }
  ],
  "adversarial_reviews": [
    {
      "claim_id": "AI-CACHE-001",
      "evidence_id": "E-AI-CACHE-001-1",
      "relation": "CONTRADICTS",
      "reviewer_id": "claude-haiku-4-5-20251001",
      "independence": "SAME_FAMILY",
      "evidence_fragment": "5-minute cache write tokens are 1.25 times the base input tokens price; 1-hour cache write tokens are 2 times the base input tokens price; Cache read tokens are 0.1 times the base input tokens price.",
      "strongest_counter_reading": "The evidence only describes pricing tiers without explaining cumulative costs across multiple requests. One could argue the evidence is incomplete rather than contradictory—perhaps the cost per request drops low enough that total cost is always cheaper even with write overhead.",
      "what_would_falsify": "Calculate the total cost of a single request with caching (1.25x write overhead) versus without caching (1x base input cost). Or run an actual API usage scenario with one or two requests and show that enabling caching increased the bill rather than decreased it."
    }
  ],
  "adversarial_policy": "required"
}
