{
  "claim_ir": {
    "claim_id": "AI-CACHE-002",
    "source_text": "命中缓存的读取按基础输入价格的十分之一计费。",
    "operator": "FACT",
    "subject": "命中缓存的读取",
    "predicate": "按基础输入价格的十分之一",
    "object": "计费",
    "polarity": "POSITIVE",
    "quantifier": "UNSPECIFIED",
    "modality": "ASSERTED",
    "scope": {},
    "anchors": {
      "subject": {
        "text": "命中缓存的读取",
        "start": 0,
        "end": 7
      },
      "predicate": {
        "text": "按基础输入价格的十分之一",
        "start": 7,
        "end": 19
      },
      "object": {
        "text": "计费",
        "start": 19,
        "end": 21
      }
    }
  },
  "evidence": [
    {
      "evidence_id": "E-AI-CACHE-002-1",
      "source_id": "DOC-PROMPT-CACHING",
      "source_kind": "official_documentation",
      "locator": "https://platform.claude.com/docs/en/build-with-claude/prompt-caching",
      "source_text": "On the Claude API, Claude Platform on AWS, Google Cloud, and Microsoft Foundry, the minimum cacheable prompt length is: 512 tokens for Claude Opus 5, Claude Fable 5, and Claude Mythos 5; 1,024 tokens for Claude Opus 4.8, Claude Sonnet 5, Claude Sonnet 4.6, Claude Sonnet 4.5. By default, the cache has a 5-minute lifetime. The previous table reflects the following pricing multipliers for prompt caching: 5-minute cache write tokens are 1.25 times the base input tokens price; 1-hour cache write tokens are 2 times the base input tokens price; Cache read tokens are 0.1 times the base input tokens price.",
      "quote": {
        "text": "Cache read tokens are 0.1 times the base input tokens price",
        "start": 544,
        "end": 603
      },
      "date": null,
      "derived_from": [],
      "cites": []
    }
  ],
  "semantic_reviews": [
    {
      "claim_id": "AI-CACHE-002",
      "evidence_id": "E-AI-CACHE-002-1",
      "relation": "ENTAILS",
      "reviewer_id": "claude-opus-5",
      "claim_fragment": "命中缓存的读取按基础输入价格的十分之一计费",
      "evidence_fragment": "Cache read tokens are 0.1 times the base input tokens price",
      "missing_bridge": ""
    }
  ],
  "adversarial_reviews": [
    {
      "claim_id": "AI-CACHE-002",
      "evidence_id": "E-AI-CACHE-002-1",
      "relation": "ENTAILS",
      "reviewer_id": "claude-haiku-4-5-20251001",
      "independence": "SAME_FAMILY",
      "evidence_fragment": "Cache read tokens are 0.1 times the base input tokens price.",
      "strongest_counter_reading": "One could argue the evidence applies only to specific platforms (Claude API, Claude Platform on AWS, Google Cloud, Microsoft Foundry) and the claim might be intended to apply more broadly, or that translation differences between '基础输入价格' and 'base input tokens price' introduce ambiguity about what constitutes the base price.",
      "what_would_falsify": "Check the current Claude API pricing page (api.anthropic.com/pricing or the official documentation URL cited in the source) to verify whether cache read tokens are charged at a different multiplier than 0.1x, or whether the multiplier varies by platform, model, or cache duration."
    }
  ],
  "adversarial_policy": "required"
}
