{
  "claim_ir": {
    "claim_id": "AI-SELF-003",
    "source_text": "让模型自己检查一遍并修改，总能得到更好的结果。",
    "operator": "FACT",
    "subject": "让模型自己检查一遍并修改",
    "predicate": "总能得到",
    "object": "更好的结果",
    "polarity": "POSITIVE",
    "quantifier": "UNSPECIFIED",
    "modality": "ASSERTED",
    "scope": {},
    "anchors": {
      "subject": {
        "text": "让模型自己检查一遍并修改",
        "start": 0,
        "end": 12
      },
      "predicate": {
        "text": "总能得到",
        "start": 13,
        "end": 17
      },
      "object": {
        "text": "更好的结果",
        "start": 17,
        "end": 22
      }
    }
  },
  "evidence": [
    {
      "evidence_id": "E-AI-SELF-003-1",
      "source_id": "PAPER-SELF-REFINE",
      "source_kind": "research_paper",
      "locator": "https://arxiv.org/abs/2303.17651",
      "source_text": "Motivated by how humans refine their written text, we introduce Self-Refine, an approach for improving initial outputs from LLMs through iterative feedback and refinement. The main idea is to generate an initial output using an LLMs; then, the same LLMs provides feedback for its output and uses it to refine itself, iteratively. We evaluate Self-Refine across 7 diverse tasks, ranging from dialog response generation to mathematical reasoning, using state-of-the-art (GPT-3.5, ChatGPT, and GPT-4) LLMs. Across all evaluated tasks, outputs generated with Self-Refine are preferred by humans and automatic metrics over those generated with the same LLM using conventional one-step generation, improving by ~20% absolute on average in task performance.",
      "quote": {
        "text": "improving by ~20% absolute on average in task performance",
        "start": 692,
        "end": 749
      },
      "date": "2023-03-30",
      "derived_from": [],
      "cites": []
    },
    {
      "evidence_id": "E-AI-SELF-003-2",
      "source_id": "PAPER-NO-SELF-CORRECT",
      "source_kind": "research_paper",
      "locator": "https://arxiv.org/abs/2310.01798",
      "source_text": "Central to our investigation is the notion of intrinsic self-correction, whereby an LLM attempts to correct its initial responses based solely on its inherent capabilities, without the crutch of external feedback. In the context of reasoning, our research indicates that LLMs struggle to self-correct their responses without external feedback, and at times, their performance even degrades after self-correction.",
      "quote": {
        "text": "their performance even degrades after self-correction",
        "start": 358,
        "end": 411
      },
      "date": "2023-10-03",
      "derived_from": [],
      "cites": []
    }
  ],
  "semantic_reviews": [
    {
      "claim_id": "AI-SELF-003",
      "evidence_id": "E-AI-SELF-003-1",
      "relation": "ENTAILS",
      "reviewer_id": "claude-opus-5",
      "claim_fragment": "让模型自己检查一遍并修改，总能得到更好的结果",
      "evidence_fragment": "improving by ~20% absolute on average in task performance",
      "missing_bridge": ""
    },
    {
      "claim_id": "AI-SELF-003",
      "evidence_id": "E-AI-SELF-003-2",
      "relation": "CONTRADICTS",
      "reviewer_id": "claude-opus-5",
      "claim_fragment": "让模型自己检查一遍并修改，总能得到更好的结果",
      "evidence_fragment": "their performance even degrades after self-correction",
      "missing_bridge": ""
    }
  ],
  "adversarial_reviews": [
    {
      "claim_id": "AI-SELF-003",
      "evidence_id": "E-AI-SELF-003-1",
      "relation": "PARTIAL",
      "reviewer_id": "claude-haiku-4-5-20251001",
      "independence": "SAME_FAMILY",
      "evidence_fragment": "Across all evaluated tasks, outputs generated with Self-Refine are preferred by humans and automatic metrics over those generated with the same LLM using conventional one-step generation, improving by ~20% absolute on average in task performance.",
      "strongest_counter_reading": "The evidence shows improvement on average across 7 tested tasks, but does not demonstrate improvement is universal or inevitable. The claim states self-checking 'always' (总能) produces better results; the evidence shows it did so in these 7 specific tasks with average gains, leaving open the possibility of tasks where improvement is negligible or variable. Additionally, Self-Refine involves structured feedback generation, not mere self-checking.",
      "what_would_falsify": "Run Self-Refine on additional diverse tasks and find at least one where performance does not improve compared to one-step generation, or show that improvement rates vary substantially by task type."
    },
    {
      "claim_id": "AI-SELF-003",
      "evidence_id": "E-AI-SELF-003-2",
      "relation": "CONTRADICTS",
      "reviewer_id": "claude-haiku-4-5-20251001",
      "independence": "SAME_FAMILY",
      "evidence_fragment": "LLMs struggle to self-correct their responses without external feedback, and at times, their performance even degrades after self-correction.",
      "strongest_counter_reading": "This could be narrowly read as applying only to 'intrinsic self-correction' (correction without external feedback), while the original claim might implicitly allow for other refinement mechanisms. However, the phrase 'at times, their performance even degrades' directly contradicts the claim's assertion that self-checking 'always' leads to better results—degradation is the opposite of improvement.",
      "what_would_falsify": "Demonstrate that in all intrinsic self-correction trials conducted in that research, performance never degraded and always improved, contradicting the reported finding of performance degradation."
    }
  ],
  "adversarial_policy": "required"
}
